<?xml version="1.0"?>
<config xmlns:xsi="http://www.w3.org/2001/XMLSchema-instance"
        xsi:noNamespaceSchemaLocation="urn:magento:module:Agusquiw_Warehouse:etc/warehouses.xsd">
    <warehouses>
        <warehouse>
            <name>Warehouse 01</name>
            <code>WH01</code>
            <postcode>000001</postcode>
        </warehouse>
        <warehouse>
            <name>Warehouse 01</name>
            <code>WH01</code>
            <postcode>000001</postcode>
        </warehouse>
        <warehouse>
            <name>Warehouse 01</name>
            <code>WH01</code>
            <postcode>000001</postcode>
        </warehouse>
        <warehouse>
            <name>Warehouse 01</name>
            <code>WH01</code>
            <postcode>000001</postcode>
        </warehouse>
    </warehouses>
</config>
